{
  "schema_version": "0.1",
  "planning_request_id": "planning-request-demo",
  "run_id": "run-demo",
  "project_id": "project-demo",
  "objective": "Executar uma tarefa verificável",
  "workflow_template_ref": {
    "id": "workflow-demo",
    "version": "1",
    "content_digest": {
      "algorithm": "sha256",
      "value": "1dfac40dae90b483528978285d88ad66b3c545136884339941f009226760b1a8"
    }
  },
  "planner_policy_ref": {
    "id": "planner-policy-fixed",
    "version": "1",
    "content_digest": {
      "algorithm": "sha256",
      "value": "aaaaaaaaaaaaaaaaaaaaaaaaaaaaaaaaaaaaaaaaaaaaaaaaaaaaaaaaaaaaaaaa"
    }
  },
  "created_at": "2026-09-29T13:00:00Z"
}
